{
  "id": "tx_01HZX8KHJNR4D42R6G4W4Q0Y0V",
  "object": "transaction",
  "payment_intent_id": "pi_01HZX8H75Z6X8C5X7JQY6B4M2N",
  "payee_id": "py_01HZX8E77KN1KZ9M2G5D5Q4N4V",
  "amount": 25000,
  "currency": "USD",
  "rail": "stripe",
  "status": "captured",
  "description": "Certified artifact purchase",
  "provenance": {
    "artifact_id": "art_01HXZ7Z8R2QQSN5B3T5VQ4D1WA",
    "certificate_id": "cert_01HXZ803C0R6V4K4P9HWB6J5N6",
    "decision_record_id": "dec_01HXZ80MCP6KNB8M3D0W1MSZV9",
    "dataset_id": "ds_01HXZ811N6C84YFJ4S2P7A5R1K",
    "receipt_hash": "sha256:3a6e0f8ed8c1f9d6f4d5b2a0cc6f12f876afc8b64c50d8b4c2c6aef6bd2b21f0",
    "external_reference": "partner:invoice-44821",
    "provenance_metadata": {
      "cdp:source_system": "partner_portal",
      "cdp:workflow_id": "wf_2026_04_06_001"
    }
  },
  "receipt": {
    "id": "rcpt_01HZX8M9QRH7Y8B4M2S2W6D1J5",
    "schema_version": "payment_receipt.v1",
    "hash": "sha256:3a6e0f8ed8c1f9d6f4d5b2a0cc6f12f876afc8b64c50d8b4c2c6aef6bd2b21f0",
    "created_at": "2026-04-06T18:42:11Z"
  },
  "created_at": "2026-04-06T18:41:52Z",
  "updated_at": "2026-04-06T18:42:11Z",
  "livemode": false
}
